{
  "schema_version": "2.0",
  "event_id": "9e3c4d5f-6071-4c8d-ae1f-2b3c4d5e6f70",
  "timestamp": "2026-06-12T15:19:02Z",
  "service": { "name": "bh-agent-control-plane", "environment": "prod" },
  "actor": {
    "subject_id": "user_123",
    "subject_type": "human",
    "org_id": "org_77",
    "roles": ["clinician"]
  },
  "action": {
    "type": "OVERRIDE",
    "name": "cancel_agent_session",
    "phi_touched": false,
    "data_classification": "NONE"
  },
  "resource": {
    "type": "AgentSession",
    "id": "agsess_01J9X0002"
  },
  "outcome": { "status": "SUCCESS" },
  "metadata": {
    "override_category": "user_cancelled",
    "agent_session_id": "agsess_01J9X0002"
  }
}
